Menjajal Path Setelah Ditutup Begini Keadaannya,"KOMPAS.com - Hari ini, Kamis 18 Oktober 2018, jejaring sosial  Path resmi ditutup setelah bertahun-tahun menjadi tempat berbagi kenangan oleh warganet Indonesia.Bagaimana keadaan Path setelah ditutup? Layanan yang didirikan oleh Dave Morin itu ternyata tak serta-merta mogok saat KompasTekno coba menjajalnya. KOMPAS.com/ BILL CLINTEN Linimasa utama Path masih berfungsi pada 18 Oktober 2018.Suasana linimasa apliaksi Path di Android ketika ditengok KompasTekno, sekitar tengah hari tadi (Waktu Indonesia Barat), terasa sepi. Hanya ada segelintir teman yang iseng mengunggah status karena ingin mencoba apakah aplikasi Path masih bisa digunakan. Baca juga: Path Ditutup 18 Oktober, Begini Cara Selamatkan FotoFitur tambah teman juga terlihat berfungsi walaupun mungkin saat ini rasanya sudah terlambat untuk berteman dengan pengguna Path lain.KompasTekno ikut membagikan sebuah posting lagu Goodbye dari Echosmith kepada teman-teman di Path, sebagai ucapan selamat tinggal KOMPAS.com/ BILL CLINTEN Video dari Path TV masih bisa diputar dengan lancar pada 18 Oktober 2018.Setelah 1 jam, jumlah view post itu sedikit, hanya 4 orang yang menontonnya, tanpa adanya like. Padahal, beberapa bulan sebelumnya, jumlah view sebuah posting bisa mencapai puluhan. Bagaimana dengan Path TV? Semua konten di kanal itu, termasuk konten dari YouTube, ternyata masih bisa dimainkan dengan lancar tanpa buffering. Baca juga: Salah Langkah dan Ingkari Konsep, Alasan Path Tak Lagi BerkembangSaat menonton video soal makanan, KompasTekno teringat janji dengan seseorang yang masih terkait dengan dunia kuliner.Fitur chat pun dibuka untuk mengontak teman dimaksud. 
 
KOMPAS.com/ BILL CLINTEN Fitur chatting dalam Path masih bisa berjalan pada 18 Oktober 2018.Ternyata, percakapan masih bisa berjalan dengan lancar sebagaimana mestinya. KompasTekno bisa mengirim dan menerima pesan dari lawan bicara.Beberapa fungsi dalam aplikasi Path memang masih normal, tapi ada juga yang sudah berhenti seperti informasi cuaca yang tak lagi menampilkan keterangan. Selain di Android, aplikasi Path untuk iOS ternyata masih bisa berfungsi. Begitu juga dengan Path versi desktop yang diakses dari peramban di alamat path.com.Meski demikian, aplikasi Path sudah tidak ada lagi di  Google Play Store maupun Apple App Store sehingga tak bisa lagi diunduh dari kedua toko aplikasi Android dan iOS tersebut.Pengguna Path masih bisa melakukan backup data lewat notifikasi yang dimunculkan di aplikasi. Apabila tidak memiliki aplikasi, backup bisa dilakukan via desktop di alamat https://path.com/settings/backups.Langkah-langkah selengkapnya untuk melakukan backup dan refund pembelian bisa dilihat dalam artikel di tautan berikut.

            googletag.cmd.push(function() { googletag.display('div-gpt-ad-974648810682144181-4112'); });","18/10/2018, 14:28 WIB"
Menjajal Path Setelah Ditutup Begini Keadaannya,"KOMPAS.com - Hari ini, Kamis 18 Oktober 2018, jejaring sosial  Path resmi ditutup setelah bertahun-tahun menjadi tempat berbagi kenangan oleh warganet Indonesia.Bagaimana keadaan Path setelah ditutup? Layanan yang didirikan oleh Dave Morin itu ternyata tak serta-merta mogok saat KompasTekno coba menjajalnya. KOMPAS.com/ BILL CLINTEN Linimasa utama Path masih berfungsi pada 18 Oktober 2018.Suasana linimasa apliaksi Path di Android ketika ditengok KompasTekno, sekitar tengah hari tadi (Waktu Indonesia Barat), terasa sepi. Hanya ada segelintir teman yang iseng mengunggah status karena ingin mencoba apakah aplikasi Path masih bisa digunakan. Baca juga: Path Ditutup 18 Oktober, Begini Cara Selamatkan FotoFitur tambah teman juga terlihat berfungsi walaupun mungkin saat ini rasanya sudah terlambat untuk berteman dengan pengguna Path lain.KompasTekno ikut membagikan sebuah posting lagu Goodbye dari Echosmith kepada teman-teman di Path, sebagai ucapan selamat tinggal KOMPAS.com/ BILL CLINTEN Video dari Path TV masih bisa diputar dengan lancar pada 18 Oktober 2018.Setelah 1 jam, jumlah view post itu sedikit, hanya 4 orang yang menontonnya, tanpa adanya like. Padahal, beberapa bulan sebelumnya, jumlah view sebuah posting bisa mencapai puluhan. Bagaimana dengan Path TV? Semua konten di kanal itu, termasuk konten dari YouTube, ternyata masih bisa dimainkan dengan lancar tanpa buffering. Baca juga: Salah Langkah dan Ingkari Konsep, Alasan Path Tak Lagi BerkembangSaat menonton video soal makanan, KompasTekno teringat janji dengan seseorang yang masih terkait dengan dunia kuliner.Fitur chat pun dibuka untuk mengontak teman dimaksud. 
 
KOMPAS.com/ BILL CLINTEN Fitur chatting dalam Path masih bisa berjalan pada 18 Oktober 2018.Ternyata, percakapan masih bisa berjalan dengan lancar sebagaimana mestinya. KompasTekno bisa mengirim dan menerima pesan dari lawan bicara.Beberapa fungsi dalam aplikasi Path memang masih normal, tapi ada juga yang sudah berhenti seperti informasi cuaca yang tak lagi menampilkan keterangan. Selain di Android, aplikasi Path untuk iOS ternyata masih bisa berfungsi. Begitu juga dengan Path versi desktop yang diakses dari peramban di alamat path.com.Meski demikian, aplikasi Path sudah tidak ada lagi di  Google Play Store maupun Apple App Store sehingga tak bisa lagi diunduh dari kedua toko aplikasi Android dan iOS tersebut.Pengguna Path masih bisa melakukan backup data lewat notifikasi yang dimunculkan di aplikasi. Apabila tidak memiliki aplikasi, backup bisa dilakukan via desktop di alamat https://path.com/settings/backups.Langkah-langkah selengkapnya untuk melakukan backup dan refund pembelian bisa dilihat dalam artikel di tautan berikut.

            googletag.cmd.push(function() { googletag.display('div-gpt-ad-974648810682144181-4112'); });","18/10/2018, 14:28 WIB"
Path Ditutup 18 Oktober 2018 Begini Cara Selamatkan Foto,"KOMPAS.com - Jika sesuai jadwal, jejaring sosial  Path akan resmi dihentikan besok (18/10/2018). Setelah tanggal tersebut, pengguna tidak bakal bisa lagi jejaring sosial yang pernah jadi tren itu, berikut semua kenangan yang pernah diunggah.
Sebelum menyesal, tidak ada salahnya menyelamatkan foto, teks, atau video yang pernah diunggah ke Path sebelum esok hari. Ada dua cara yang bisa dilakukan.
Pertama, pengguna bisa mencadangkan data melalui desktop atau mobile dengan mengunjungi https://path.com/settings.backups.
Kompas.com Masukan alamat e-mail ke kolom yang berlingkar kuning. Jika sudah mengirim permintaan, pengguna akan menerima notifikasi seperti yang tertera di dalam lingkaran biru.Setelah masuk, pengguna harus melakukan proses log-in terlebih dahulu ke akun Path. Kemudian, masukan alamat e-mail, lalu tim Path akan mengirim semua data backup ke e-mail tersebut.
Kedua, khusus melalui mobile versi paling baru, pengguna cukup membuka menu ""settings"".Di sana Anda akan menemui opsi ""backup"" dan diminat untuk meamsukan e-mail sebagai alamat pengiriman data backup.
Kompas.com Tangkapan layar backup data Path. Setelah buak menu Settings pilih opsi Backup yang ada di paling atas. Kemudian masukan e-mail sebagai alamat tujuan backup data.
Proses refund pelanggan premium
Selain backup data, pengguna Path premium juga bisa melakukan refund. Untuk pemngguna Android, cukuo kirim e-mail ke service@ path.com untuk meminta pengembalian uang. Nantinya, pengguna akan dimintai alamat e-mail Path dan nomor transaksi Google.
Untuk melihat nomor transaksi, pengguna bisa mengunjungi situs https://pay.google.com/payments/u/1/home.
Setelah memberikan dokumen yang diminta, tunggu balasan dari tim Path. Pengguna akan mendapat balasan dalam rentang waktu 14 hari kerja setelah diajukan. Megenai tahapan pengembalian bisa dicek melalui tautan https://play.google.com/store/account?feature=gp_receipt.
Sementara untuk pengguna Path iOS bisa mengunjungi laman https://expresslane.apple.com/GetproductgroupList.action untuk melakukan backup data. Kemudian, pilih jenis perangkat yang Anda gunakan untuk mengakses Path, apakah iPhone, iPad atau lainnya.
Baca juga: Tahapan Penutupan Path, dari Penarikan Aplikasi hingga Berhenti Total
Pilih ""Subscriptions & Purchases"", kemudian pilih ""The Topic is not Listed"". Jelaskan situasi Anda,kemudain pilih opsi ""Email"" untuk mendapat respons dari Apple. Jangan lupa untuk memastikan bahwa Anda telah mencantumkan nama lengkap, alamat e-mail, Apple ID, dan nomor transaksi yang akurat di e-mail.

            googletag.cmd.push(function() { googletag.display('div-gpt-ad-974648810682144181-4112'); });","17/10/2018, 19:16 WIB"
Siapsiap Layanan Path Berhenti Total Besok,"KOMPAS.com - Sebulan lalu,  jejaring sosial Path resmi mengonfirmasi kabar penutupannya. Jika menilik jadwal penutupan, tanggal 1 Oktober lalu, aplikasi Path sudah tidak bisa diperbarui di toko aplikasi, baik Android maupun iOS.
Selanjutnya, tepat esok hari, Kamis (18/10/2018), layanan Path bakal dihentikan total. Alhasil, para pengguna Path tidak akan bisa lagi membuka jaringan sosial itu lagi setelah esok hari. Kemudian, Path akan menutup layanan customer service pada 15 November mendatang.
""Dengan penyesalan mendalam kami mengumumkan bahwa kami akan berhenti menyediakan layanan kami yang dicintai, Path,"" tulis tim Path dalam unggahan berisi pengumuman di situsnya dengan judul ""The Last Goodbye"".
Baca juga: Tahapan Penutupan Path, dari Penarikan Aplikasi hingga Berhenti Total
Penutupan Path sempat menghebohkan warganet. Mereka berbondong-bondong untuk mengenang kembali aktivitasnya bersama Path di Twitter dan Instagram Stories.
""Sepanjang perjalanan, kami telah tertawa dan menangis bersama Anda. Kini penutupan layanan sudah tidak terhindarkan untuk memprioritaskan kerja kami, untuk menyediakan produk dan layanan yang lebih baik untuk Anda,"" lanjut Path.
 Jejaring sosial ini pun sempat menjadi tren di Indonesia, di mana negara ini juga menjadi pengguna terbesar Path. Namun minimnya inovasi dan penyimpangan konsep awal, disinyalir menjadi alasan Path tertinggal dari jejaring sosial lain, seperti Instagram atau Twitter.
Baca juga: Salah Langkah dan Ingkari Konsep, Alasan Path Tak Lagi Berkembang
Pembaruan teranyar sekaligus terakhir Path adalah fitur berbasis video, di mana pengguna bisa mengeksplorasi konten-konten menarik di Path. Sebelum resmi ditutup, pengguna bisa menyelamatkan kenangan arsip data mereka berupa foto, teks, dan video yang diunggah ke Path. Caranya bisa disimak di tautan berikut.

            googletag.cmd.push(function() { googletag.display('div-gpt-ad-974648810682144181-4112'); });","17/10/2018, 17:13 WIB"
Siapsiap Layanan Path Berhenti Total Besok,"KOMPAS.com - Sebulan lalu,  jejaring sosial Path resmi mengonfirmasi kabar penutupannya. Jika menilik jadwal penutupan, tanggal 1 Oktober lalu, aplikasi Path sudah tidak bisa diperbarui di toko aplikasi, baik Android maupun iOS.
Selanjutnya, tepat esok hari, Kamis (18/10/2018), layanan Path bakal dihentikan total. Alhasil, para pengguna Path tidak akan bisa lagi membuka jaringan sosial itu lagi setelah esok hari. Kemudian, Path akan menutup layanan customer service pada 15 November mendatang.
""Dengan penyesalan mendalam kami mengumumkan bahwa kami akan berhenti menyediakan layanan kami yang dicintai, Path,"" tulis tim Path dalam unggahan berisi pengumuman di situsnya dengan judul ""The Last Goodbye"".
Baca juga: Tahapan Penutupan Path, dari Penarikan Aplikasi hingga Berhenti Total
Penutupan Path sempat menghebohkan warganet. Mereka berbondong-bondong untuk mengenang kembali aktivitasnya bersama Path di Twitter dan Instagram Stories.
""Sepanjang perjalanan, kami telah tertawa dan menangis bersama Anda. Kini penutupan layanan sudah tidak terhindarkan untuk memprioritaskan kerja kami, untuk menyediakan produk dan layanan yang lebih baik untuk Anda,"" lanjut Path.
 Jejaring sosial ini pun sempat menjadi tren di Indonesia, di mana negara ini juga menjadi pengguna terbesar Path. Namun minimnya inovasi dan penyimpangan konsep awal, disinyalir menjadi alasan Path tertinggal dari jejaring sosial lain, seperti Instagram atau Twitter.
Baca juga: Salah Langkah dan Ingkari Konsep, Alasan Path Tak Lagi Berkembang
Pembaruan teranyar sekaligus terakhir Path adalah fitur berbasis video, di mana pengguna bisa mengeksplorasi konten-konten menarik di Path. Sebelum resmi ditutup, pengguna bisa menyelamatkan kenangan arsip data mereka berupa foto, teks, dan video yang diunggah ke Path. Caranya bisa disimak di tautan berikut.

            googletag.cmd.push(function() { googletag.display('div-gpt-ad-974648810682144181-4112'); });","17/10/2018, 17:13 WIB"
Oppo Habiskan Rp 437 Miliar Per Tahun Rekrut Karyawan Muda,"SHENZHEN, KOMPAS.com - Perusahaan ponsel pintar asal China,  Oppo rela menggelontorkan dana sebesar 200 juta Yuan atau sekitar Rp 437 miliar setiap tahun untuk proses rekrutmen pegawai. Selain untuk proses rekrutmen, dana ini juga digunakan untuk beasiswa universitas hingga pengembangan karyawan.Menurut Jin Haishao, staff Human Resource Oppo Global, keseluruh dana tersebut memang terbilang cukup besar karena hal itu masuk dalam hitungan investasi. Menurutnya, perusahaan pun lebih memertimbangkan karyawan usia muda daripada karyawan senior.""Kami merekrut karyawan usia muda. Bahkan kebanyakan dari mereka baru lulus dari universitas. Ini karena mereka sangat lincah dan kreatif,"" ungkap Jin saat ditemui KompasTekno di kantor pusat Oppo di kawasan Shenzhen, China.Ia melanjutkan, seluruh dana tersebut akan dioptimasi dalam empat sektor yakni untuk mendanai penelitian teknologi di universitas, untuk kontes teknologi, untuk beasiswa, dan untuk pelatihan karyawan. Baca juga: Mayoritas Petinggi Oppo adalah Anak Muda, Ini AlasannyaKeempat sektor itu disebut memiliki skala prioritas masing-masing sehingga dana yang dibagi bisa berbeda jumlahnya. Kendati demikian ia tak menjelaskan secara rinci anggaran yang digelontorkan di setiap sektor. ""Kami percaya ini adalah bagian dari investasi kami untuk perusahaan,"" imbuhnya.Oppo sendiri memiliki kebijakan untuk memprioritaskan karyawan berusia muda untuk menduduki jabatan tinggi di perusahaan. Hal ini karena anak muda dianggap masih memiliki mental yang dapat dibentuk sesuai dengan visi perusahaan. Selain itu, dari data internal Oppo menyebutkan bahwa sebanyak 42 persen petinggi yang menduduki posisi supervisor berusia tak lebih dari 32 tahun. Termasuk AVP Oppo China, Brian Shen. Sementara persentase supervisor yang lahir setelah 1990 sebanyak 3,5 persen dari keseluruhan.Jika dibandingkan dengan perusahaan teknologi lain, usia rata-rata pegawai Oppo memang tergolong muda. Bandingkan saja dengan Apple yang usia rata-ratanya adalah 31 tahun, Google 30 tahun, sedangkan Oppo 29,5 tahun.

            googletag.cmd.push(function() { googletag.display('div-gpt-ad-974648810682144181-4112'); });","26/10/2018, 09:41 WIB"
Oppo Habiskan Rp 437 Miliar Per Tahun Rekrut Karyawan Muda,"SHENZHEN, KOMPAS.com - Perusahaan ponsel pintar asal China,  Oppo rela menggelontorkan dana sebesar 200 juta Yuan atau sekitar Rp 437 miliar setiap tahun untuk proses rekrutmen pegawai. Selain untuk proses rekrutmen, dana ini juga digunakan untuk beasiswa universitas hingga pengembangan karyawan.Menurut Jin Haishao, staff Human Resource Oppo Global, keseluruh dana tersebut memang terbilang cukup besar karena hal itu masuk dalam hitungan investasi. Menurutnya, perusahaan pun lebih memertimbangkan karyawan usia muda daripada karyawan senior.""Kami merekrut karyawan usia muda. Bahkan kebanyakan dari mereka baru lulus dari universitas. Ini karena mereka sangat lincah dan kreatif,"" ungkap Jin saat ditemui KompasTekno di kantor pusat Oppo di kawasan Shenzhen, China.Ia melanjutkan, seluruh dana tersebut akan dioptimasi dalam empat sektor yakni untuk mendanai penelitian teknologi di universitas, untuk kontes teknologi, untuk beasiswa, dan untuk pelatihan karyawan. Baca juga: Mayoritas Petinggi Oppo adalah Anak Muda, Ini AlasannyaKeempat sektor itu disebut memiliki skala prioritas masing-masing sehingga dana yang dibagi bisa berbeda jumlahnya. Kendati demikian ia tak menjelaskan secara rinci anggaran yang digelontorkan di setiap sektor. ""Kami percaya ini adalah bagian dari investasi kami untuk perusahaan,"" imbuhnya.Oppo sendiri memiliki kebijakan untuk memprioritaskan karyawan berusia muda untuk menduduki jabatan tinggi di perusahaan. Hal ini karena anak muda dianggap masih memiliki mental yang dapat dibentuk sesuai dengan visi perusahaan. Selain itu, dari data internal Oppo menyebutkan bahwa sebanyak 42 persen petinggi yang menduduki posisi supervisor berusia tak lebih dari 32 tahun. Termasuk AVP Oppo China, Brian Shen. Sementara persentase supervisor yang lahir setelah 1990 sebanyak 3,5 persen dari keseluruhan.Jika dibandingkan dengan perusahaan teknologi lain, usia rata-rata pegawai Oppo memang tergolong muda. Bandingkan saja dengan Apple yang usia rata-ratanya adalah 31 tahun, Google 30 tahun, sedangkan Oppo 29,5 tahun.

            googletag.cmd.push(function() { googletag.display('div-gpt-ad-974648810682144181-4112'); });","26/10/2018, 09:41 WIB"
Ini Alasan Smartfren Hentikan Bisnis Ponsel Andromax,"PALEMBANG, KOMPAS.com - September lalu, Deputy CEO  Smartfren Djoko Tata Ibrahim memastikan nasib  Andromax. Jajaran handset yang telah menemani Smartfren sepanjang kiprahnya sebagai operator seluler CDMA hingga 4G LTE itu akan dihentikan pada pertengahan 2019 mendatang.Penyetopan Andromax bukan tanpa alasan. Vice President Technology Relations and Special Project Smartfren, Munir Syahda Prabowo mengatakan bahwa keputusan untuk menghentikan Andromax diambil lantaran Smartfren memandang tugasnya sudah “selesai”.Pendukung jaringanMunir bercerita, Andromax dulu tercetus pada 2010, ketika Smartfren menjadi operator CDMA terbesar di Indonesia setelah merger Smart Telecom dengan Mobile-8. Ketika itu, tak ada banyak handset di pasaran yang mendukung teknologi jaringan CDMA Smartfren sehingga sang operator merasa perlu langkah tambahan untuk mendukung pertumbuhan pelanggan di jaringannya. “Untuk sosialisasi CDMA dengan lebih cepat, maka Smartfren masuk ke ranah handset, lewat kemitraan strategis (dengan para rekanan pemanufaktur perangkat,” ujar Munir ketika ditemui KompasTekno di sela rangkaian acara 4G Plus Network Experience Smartfren di Palembang, Sumatera Selatan, Kamis (25/10/2018).Baca juga: Setop Bisnis Ponsel Andromax, Smartfren Fokus Bangun Jaringan 4GKehadiran Andromax ternyata efektif menaikkan pangsa pasar dan pelanggan Smartfren. Hingga kemudian, pada 2015, Smartfren memutuskan untuk hijrah dari teknologi CDMA yang pengembangannya sudah mandek, ke 4G LTE (GSM),KOMPAS.com/Oik Yusuf Araya Vice President Technology Relations and Special Project Smartfren, Munir Syahda Prabowo.Saat hendak beralih menuju 4G LTE itu pun, di pasaran belum banyak tersedia handset 4G LTE, terutama yang mendukung frekuensi 4G TDD Smartfren di pita 850 MHz dan 2.300 MHz. “Jasa” Andromax kembali diperlukan, supaya memudahkan pelanggan CDMA bermigrasi ke 4G LTE, sekaligus mencegah mereka beralih ke operator lain.“Handset yang support band 4G yang sesuai dengan Smartfren ketika itu terbatas. Kami memang unik, pakai band 5 (850 MHz) dan 40 (2.300 MHz). Operator lain kebanyakan band 1 (2.100 MHz) dan 3 (1.800 MHz), Mau tak mau, Smartfren tetap mengeluarkan seri Andromax untuk mendorong perkembangan pelanggan 4G LTE,” imbuh Munir.ParipurnaBeberapa tahun berselang, keadaan pasar berubah. Kini sudah banyak beredar perangkat handset multi-band LTE dari segala segmen harga yang kompatibel dengan teknologi jaringan 4G Smartfren, termasuk Voice over LTE (VoLTE). Smartfren pun kini lebih mengarahkan pelanggan ke handset open market lewat kerja sama dengan sejumlah vendor dan perangkat 4G mobile WiFi router (MiFi). Tugas Andromax dianggap sudah paripurna. “Maka, sekarang ini sudah masanya. Karena pada dasarnya Smartfren adalah perusahaan telekomunikasi seperti telco lain, maka kami kembali ke bisnis inti. Jadi ini (perjalanan Andromax) adalah historical path, bukan semata-mata bisnis,” lanjut Munir. Kendati Andromax sudah ditetapkan bakal berhenti tahun depan, Munir mengatakan tidak menutup kemungkinan lini ponsel Andromax kembali dilanjutkan, misalnya lewat perusahaan yang berdiri terpisah. “Kalau kami yakin bisa bersaing dengan handset open market, maka bisa saja (Andromax) kami buat untuk dijual ke umum. Kemungkinannya banyak, tapi belum ada pembicaraan ke sana. Untuk sekarang kami fokus dulu mendukung pengembangan jaringan Smartfren,” pungkas Munir.

            googletag.cmd.push(function() { googletag.display('div-gpt-ad-974648810682144181-4112'); });","26/10/2018, 08:12 WIB"
Ini Alasan Smartfren Hentikan Bisnis Ponsel Andromax,"PALEMBANG, KOMPAS.com - September lalu, Deputy CEO  Smartfren Djoko Tata Ibrahim memastikan nasib  Andromax. Jajaran handset yang telah menemani Smartfren sepanjang kiprahnya sebagai operator seluler CDMA hingga 4G LTE itu akan dihentikan pada pertengahan 2019 mendatang.Penyetopan Andromax bukan tanpa alasan. Vice President Technology Relations and Special Project Smartfren, Munir Syahda Prabowo mengatakan bahwa keputusan untuk menghentikan Andromax diambil lantaran Smartfren memandang tugasnya sudah “selesai”.Pendukung jaringanMunir bercerita, Andromax dulu tercetus pada 2010, ketika Smartfren menjadi operator CDMA terbesar di Indonesia setelah merger Smart Telecom dengan Mobile-8. Ketika itu, tak ada banyak handset di pasaran yang mendukung teknologi jaringan CDMA Smartfren sehingga sang operator merasa perlu langkah tambahan untuk mendukung pertumbuhan pelanggan di jaringannya. “Untuk sosialisasi CDMA dengan lebih cepat, maka Smartfren masuk ke ranah handset, lewat kemitraan strategis (dengan para rekanan pemanufaktur perangkat,” ujar Munir ketika ditemui KompasTekno di sela rangkaian acara 4G Plus Network Experience Smartfren di Palembang, Sumatera Selatan, Kamis (25/10/2018).Baca juga: Setop Bisnis Ponsel Andromax, Smartfren Fokus Bangun Jaringan 4GKehadiran Andromax ternyata efektif menaikkan pangsa pasar dan pelanggan Smartfren. Hingga kemudian, pada 2015, Smartfren memutuskan untuk hijrah dari teknologi CDMA yang pengembangannya sudah mandek, ke 4G LTE (GSM),KOMPAS.com/Oik Yusuf Araya Vice President Technology Relations and Special Project Smartfren, Munir Syahda Prabowo.Saat hendak beralih menuju 4G LTE itu pun, di pasaran belum banyak tersedia handset 4G LTE, terutama yang mendukung frekuensi 4G TDD Smartfren di pita 850 MHz dan 2.300 MHz. “Jasa” Andromax kembali diperlukan, supaya memudahkan pelanggan CDMA bermigrasi ke 4G LTE, sekaligus mencegah mereka beralih ke operator lain.“Handset yang support band 4G yang sesuai dengan Smartfren ketika itu terbatas. Kami memang unik, pakai band 5 (850 MHz) dan 40 (2.300 MHz). Operator lain kebanyakan band 1 (2.100 MHz) dan 3 (1.800 MHz), Mau tak mau, Smartfren tetap mengeluarkan seri Andromax untuk mendorong perkembangan pelanggan 4G LTE,” imbuh Munir.ParipurnaBeberapa tahun berselang, keadaan pasar berubah. Kini sudah banyak beredar perangkat handset multi-band LTE dari segala segmen harga yang kompatibel dengan teknologi jaringan 4G Smartfren, termasuk Voice over LTE (VoLTE). Smartfren pun kini lebih mengarahkan pelanggan ke handset open market lewat kerja sama dengan sejumlah vendor dan perangkat 4G mobile WiFi router (MiFi). Tugas Andromax dianggap sudah paripurna. “Maka, sekarang ini sudah masanya. Karena pada dasarnya Smartfren adalah perusahaan telekomunikasi seperti telco lain, maka kami kembali ke bisnis inti. Jadi ini (perjalanan Andromax) adalah historical path, bukan semata-mata bisnis,” lanjut Munir. Kendati Andromax sudah ditetapkan bakal berhenti tahun depan, Munir mengatakan tidak menutup kemungkinan lini ponsel Andromax kembali dilanjutkan, misalnya lewat perusahaan yang berdiri terpisah. “Kalau kami yakin bisa bersaing dengan handset open market, maka bisa saja (Andromax) kami buat untuk dijual ke umum. Kemungkinannya banyak, tapi belum ada pembicaraan ke sana. Untuk sekarang kami fokus dulu mendukung pengembangan jaringan Smartfren,” pungkas Munir.

            googletag.cmd.push(function() { googletag.display('div-gpt-ad-974648810682144181-4112'); });","26/10/2018, 08:12 WIB"
