Nokia Bakal Punya Penerus Ponsel Pisang 4G,"KOMPAS.com - Belum lama peluncuran ponsel fitur  Nokia 8110 4G di pasaran, HMD Global dikabarkan akan meluncurkan generasi penerus ponsel yang disebut 'ponsel pisang' itu. Ajey Mehta, Vice President & Country Head India HMD Global, menyatakan pihaknya berencana akan memperluas pasar ponsel fitur 4G-nya lewat beberapa penawaran menarik.""Kami juga menjajaki kemungkinan meluncurkan ponsel fitur 4G dengan harga terjangkau."" ujar Mehta.Mehta menyebut, segmentasi pasar ponsel 2G Nokia, dan ponsel fitur secara umum, sangat melonjak di pasaran, terutama di India. Permintaan akan ponsel yang tidak seperti smartphone itu pun masih besar. ""Pasar (pasar ponsel fitur) selalu kompetitif dari dulu dan akan terus sama ke depannya."" sebut Mehta.Baca juga: Nokia 8110 Pisang Lahir Kembali dengan 4GDia juga menambahkan konektivitas 2G, yang banyak tersemat di ponsel fitur Nokia, tidak lama lagi akan ditinggalkan, karena sudah ketinggalan zaman. Melihat hal tersebut, bukan tidak mungkin HMD akan meluncurkan  penerus 'ponsel pisang' Nokia dengan menghadirkan ponsel fitur dengan kapabilitas 4G untuk menjawab kebutuhan pasar ponsel fitur yang masih banyak diminati.Kendati begitu, pihak HMD ataupun Mehta sendiri masih enggan memberikan informasi apa pun terkait detail ponsel fitur lanjutan 'ponsel pisang' itu, sebagaimana dilansir KompasTekno dari DNAIndia, Kamis (25/10/2018). Baca juga: Zaman Smartphone, Smartfren Kok Malah Rilis Feature Phone?Seperti diketahui, HMD Global telah meluncurkan ponsel fitur 4G Nokia 8110, atau yang biasa disebut 'ponsel pisang', Agustus silam.Ponsel ini adalah hasil penyegaran dari seri Nokia 8110 klasik yang diluncurkan September 1996.Dengan tambahan konektivitas 4G, ponsel pisang ini diklaim dapat mengakses berapa aplikasi yang ada di Play Store, seperti Google Assistant, Maps, Google Search, Facebook, dan kemampuan e-mail. 

            googletag.cmd.push(function() { googletag.display('div-gpt-ad-974648810682144181-4112'); });","25/10/2018, 13:17 WIB"
Facebook Tambah Fitur Musik di Stories dan Profil,"KOMPAS.com -  Facebook meluncurkan fitur baru yang memungkinkan pengguna pamer  musik di Facebook  Stories dan profil. Fitur tersebut mulai digulirkan hari ini.
Cara menggunakannya pun mirip dengan menyisipkan musik Spotify di Instagram Stories. Cukup ketuk stiker ""Music"" di kamera Facebook dan pilih lagu yang ingin dibagikan. Nantinya, stike lagu akan muncul lengkap dengan judul dan nama penyanyinya.
Pengguna bisa memilih bagian tertentu dari lagu yang ingin dimainkan, atau bisa juga memainkan keseluruhan lagu sampai Stories berakhir. Fitur ini bisa dijajal oleh pengguna iOS dan Android.
Tapi sayangnya baru menyasar pengguna di beberapa negara, yakni AS, Australia, Belgia, Republik Ceko, Perancis, Jerman, Inggris Raya, Irlandia, Italia, Luksemburg, Meksiko, Selandia Baru, Portugal, Spanyol, Swedia, dan Swiss.
Untuk saat ini, fitur berbagi musik di Stories baru menyediakan beberapa pilihan lagu saja. Facebook berjanji akan memperkaya pustaka lagu ke depannya.Baca juga: Instagram Stories Mulai Bisa Disisipi Musik
Tak hanya di Stories, Facebook juga akan memudahkan pengguna berbagi musik di profil. Jika Anda pernah menggunakan MySpace, fitur ini kurang lebih sama.
Nantinya, pengguna bisa menambahkan segmen musikdi profil Facebook dan menyematkan lagu di bagian atas profil.
Sebenarnya, musik yang disematkan bukanlah musik yang benar-benar sedang didengarkan secara real-time dan terpasang secara otomatis. Pengguna bebas memilih lagu yang ingin dibagikan dan mengaturnya secara manual.
Variety Fitur Lip Sync Live mendapat pembaruan berupa lirik lagu
Jika ada teman Facebook yang mengunjungi profil dan melihat sematan lagu tersebut, mereka bisa membuka dan mendengarkan potongan beberapa daftar putar. Fitur ini akan sangat bermanfaat bagi para musisi untuk mempromosikan karya barunya.Baca juga: Facebook Segarkan Wajah Messenger, Mode Gelap Segera Datang
Dilansir KompasTekno dari The Next Web, Kamis (25/10/2018), penambahan fitur musik ini semakin meyakinkan kesepakatan lisensi musik anatara Facebook dan beberapa rumah produksi musik kenamaan seperti UMG, Sony Music, dan Warner Bros.
Pertengahan tahun lalu, Facebook telah meluncurkan fitur ""Lip Sync Live"" yang digadang menyaingi platorm Tik Tok. Ftur ini juga mendapat pembaruan, dengan tambahan lirik untuk memudahkan pengguna saat karaoke.

            googletag.cmd.push(function() { googletag.display('div-gpt-ad-974648810682144181-4112'); });","25/10/2018, 12:21 WIB"
Google Permudah Hapus Riwayat Pencarian Begini Caranya,"KOMPAS.com - Maraknya pemberitaan tentang pembobolan data dan privasi membuat  Google memperbarui fiturnya. Google memberikan 'update' dengan mempermudah pengguna menghapus riwayat pencarian pada Google Search.Seperti diketahui, Google menyimpan semua data yang pengguna cari, termasuk kata kunci, website, pencarian video, dll, dalam servernya. Ketika pengguna penghapus riwayat pencarian pada web browser, 'history' di server Google tidak akan terhapus. Sekarang, seluruh aktivitas pencarian pada server tersebut dapat dihapus dengan adanya pembaruan ini. Cara menghapusnya pun cukup mudah. Sebelumnya, pengguna diharuskan login dengan akun Google pribadi di web Google Search.Dengan mengunjungi web Google Search, seperti gambar pada mobile web, penguna dapat mengklik ikon 'tiga strip' pada pojok kiri atas lalu pilih ""Your data in Search"". Setelah itu, pengguna akan melihat pilihan penghapusan di paling atas halaman. Istimewa Cara menghapus riwayat pencarian di Google Search.Ada pilihan ""Delete last hour"" yang berarti menghapus pencarian selama satu jam ke belakang, ada pula opsi ""Delete all Searches"" untuk melenyapkan semua pencarian yang pernah pengguna lakukan di Google Search.Baca juga: Cara Hapus Riwayat Pencarian Google di Desktop dan MobileRaksasa Mountain View itu meluncurkan pembaruan penghapusan riwayat pencarian untuk aplikasi browser desktop dan mobile (Android dan iOS). Sementara untuk aplikasi Google Search (bukan aplikasi browser), dikutip KompasTekno dari blog resmi Google, Kamis (25/10/2018), di iOS dan Android akan secara perlahan dibagikan dalam beberapa minggu mendatang. Ada pula pembaruan untuk pengaturan iklan dalam pencarian. Ini untuk memudahkan pengguna menyesuaikan iklan yang ada pada Google Search ketika mencari sesuatu, agar relevan dengan iklan yang dilihat. Iklan tersebut dapat dipersonalisasi di bagian bawah halaman pengaturan ""Your data in Search"".Sang robot pencari yang didirikan Larry Page juga menjanjikan perubahan yang sama, penghapusan pencarian lokasi atau apa pun dalam Google Maps, tahun depan.Seperti diketahui, kontrol privasi baru ini muncul ketika maraknya skandal privasi menyerang beberapa raksasa teknologi seperti Facebook, yang data 50 juta penggunanya dibobol dan sedang diuji oleh sistem GDPR baru di Eropa. Apple juga terserang masalah privasi pada pembobolan data Apple ID pengguna yang ujungnya menguras dana pengguna.

            googletag.cmd.push(function() { googletag.display('div-gpt-ad-974648810682144181-4112'); });","25/10/2018, 11:03 WIB"
Google Permudah Hapus Riwayat Pencarian Begini Caranya,"KOMPAS.com - Maraknya pemberitaan tentang pembobolan data dan privasi membuat  Google memperbarui fiturnya. Google memberikan 'update' dengan mempermudah pengguna menghapus riwayat pencarian pada Google Search.Seperti diketahui, Google menyimpan semua data yang pengguna cari, termasuk kata kunci, website, pencarian video, dll, dalam servernya. Ketika pengguna penghapus riwayat pencarian pada web browser, 'history' di server Google tidak akan terhapus. Sekarang, seluruh aktivitas pencarian pada server tersebut dapat dihapus dengan adanya pembaruan ini. Cara menghapusnya pun cukup mudah. Sebelumnya, pengguna diharuskan login dengan akun Google pribadi di web Google Search.Dengan mengunjungi web Google Search, seperti gambar pada mobile web, penguna dapat mengklik ikon 'tiga strip' pada pojok kiri atas lalu pilih ""Your data in Search"". Setelah itu, pengguna akan melihat pilihan penghapusan di paling atas halaman. Istimewa Cara menghapus riwayat pencarian di Google Search.Ada pilihan ""Delete last hour"" yang berarti menghapus pencarian selama satu jam ke belakang, ada pula opsi ""Delete all Searches"" untuk melenyapkan semua pencarian yang pernah pengguna lakukan di Google Search.Baca juga: Cara Hapus Riwayat Pencarian Google di Desktop dan MobileRaksasa Mountain View itu meluncurkan pembaruan penghapusan riwayat pencarian untuk aplikasi browser desktop dan mobile (Android dan iOS). Sementara untuk aplikasi Google Search (bukan aplikasi browser), dikutip KompasTekno dari blog resmi Google, Kamis (25/10/2018), di iOS dan Android akan secara perlahan dibagikan dalam beberapa minggu mendatang. Ada pula pembaruan untuk pengaturan iklan dalam pencarian. Ini untuk memudahkan pengguna menyesuaikan iklan yang ada pada Google Search ketika mencari sesuatu, agar relevan dengan iklan yang dilihat. Iklan tersebut dapat dipersonalisasi di bagian bawah halaman pengaturan ""Your data in Search"".Sang robot pencari yang didirikan Larry Page juga menjanjikan perubahan yang sama, penghapusan pencarian lokasi atau apa pun dalam Google Maps, tahun depan.Seperti diketahui, kontrol privasi baru ini muncul ketika maraknya skandal privasi menyerang beberapa raksasa teknologi seperti Facebook, yang data 50 juta penggunanya dibobol dan sedang diuji oleh sistem GDPR baru di Eropa. Apple juga terserang masalah privasi pada pembobolan data Apple ID pengguna yang ujungnya menguras dana pengguna.

            googletag.cmd.push(function() { googletag.display('div-gpt-ad-974648810682144181-4112'); });","25/10/2018, 11:03 WIB"
Video Handson Pocophone F1 Ada Harga Ada Rupa,"KOMPAS.com - Pocophone F1 bisa dibilang sebagai “perusak harga pasar”. Untuk smartphone berprosesor Snapdragon 845, perdana dari sub-brand Xiaomi tersebut dipatok terlampu murah, mulai Rp 4 jutaan. Tak cuma soal prosesor, Pocophone F1 pun punya rentetan spesifikasi mentereng lainnya. Sebut saja baterai berkapasitas jumbo 4.000 mAh, sistem pendingin cair (liquid cooling system), serta kamera ganda dengan teknologi Artificial Intelligence (AI). Pertama kali mendapat kesempatan menggenggam Pocophone F1, KompasTekno langsung dibuat maklum dengan harganya yang terjangkau.
Pasalnya, material punggung ponsel ini masih memakai plastik (policarbonat), bukan kaca (glass) atau metal layaknya perangkat flagship. Namun, ada yang mengganjal saat menatap layar Pocophone F1. Kecerahan dan kualitas tak setara dengan ponsel flagship lainnya yang menggunakan layar OLED atau LED. Layar Pocophone F1 ternyata menggunakan teknologi layar smartphone ""murah"", yaitu LCD. Seperti diketahui, ponsel dengan layar LCD memiliki kontras dan tone warna yang tak terlalu tajam. Baca juga: Layar Samsung Galaxy Note 9 Dapat Gelar TerbaikMeski begitu, bahasa desain Pocophone F1 tampak modis dengan layar jumbo 6,18 inci yang sifatnya full-screen. Resolusinya Full HD dengan aspek rasio 18,7:9.Pada bagian atas terpatri poni (notch) yang mirip dengan iPhone X. Notch ini sebagai wadah kamera depan 20 megapiksel, sensor infrared untuk fitur face unlock, serta earpiece. Di sisi bawahnya ada dagu tipis sebagai aksen yang mempermanis. Baca juga: Pocophone F1 yang Dijual Xiaomi di Indonesia BermasalahSisian kanannya diletakan tombol volume up/down dan on/off. Lantas di sisian lainnya ada slot microSD bersifat hibrida. Pengguna bisa memlih antara dual nano-SIM atau microSD hingga 256GB. Sisian atas menjadi rumah untuk port audio jack 3,5mm, sementara sisian bawahnya ada port USB-C yang berdampingan dengan kisi-kisi speaker.Beralih ke belakang, ada modul kamera ganda yang diatur vertikal. Masing-masing berkualitas 12 megapiksel dan 5 megapiksel, dilengkapi dual LED flash untuk memotret di kondisi cahaya minim. Untuk melihat penjajalan KompasTekno selengkapnya, tonton video hands-on Pocophone F1 via tautan ini.

            googletag.cmd.push(function() { googletag.display('div-gpt-ad-974648810682144181-4112'); });","27/08/2018, 20:48 WIB"
Video Handson Pocophone F1 Ada Harga Ada Rupa,"KOMPAS.com - Pocophone F1 bisa dibilang sebagai “perusak harga pasar”. Untuk smartphone berprosesor Snapdragon 845, perdana dari sub-brand Xiaomi tersebut dipatok terlampu murah, mulai Rp 4 jutaan. Tak cuma soal prosesor, Pocophone F1 pun punya rentetan spesifikasi mentereng lainnya. Sebut saja baterai berkapasitas jumbo 4.000 mAh, sistem pendingin cair (liquid cooling system), serta kamera ganda dengan teknologi Artificial Intelligence (AI). Pertama kali mendapat kesempatan menggenggam Pocophone F1, KompasTekno langsung dibuat maklum dengan harganya yang terjangkau.
Pasalnya, material punggung ponsel ini masih memakai plastik (policarbonat), bukan kaca (glass) atau metal layaknya perangkat flagship. Namun, ada yang mengganjal saat menatap layar Pocophone F1. Kecerahan dan kualitas tak setara dengan ponsel flagship lainnya yang menggunakan layar OLED atau LED. Layar Pocophone F1 ternyata menggunakan teknologi layar smartphone ""murah"", yaitu LCD. Seperti diketahui, ponsel dengan layar LCD memiliki kontras dan tone warna yang tak terlalu tajam. Baca juga: Layar Samsung Galaxy Note 9 Dapat Gelar TerbaikMeski begitu, bahasa desain Pocophone F1 tampak modis dengan layar jumbo 6,18 inci yang sifatnya full-screen. Resolusinya Full HD dengan aspek rasio 18,7:9.Pada bagian atas terpatri poni (notch) yang mirip dengan iPhone X. Notch ini sebagai wadah kamera depan 20 megapiksel, sensor infrared untuk fitur face unlock, serta earpiece. Di sisi bawahnya ada dagu tipis sebagai aksen yang mempermanis. Baca juga: Pocophone F1 yang Dijual Xiaomi di Indonesia BermasalahSisian kanannya diletakan tombol volume up/down dan on/off. Lantas di sisian lainnya ada slot microSD bersifat hibrida. Pengguna bisa memlih antara dual nano-SIM atau microSD hingga 256GB. Sisian atas menjadi rumah untuk port audio jack 3,5mm, sementara sisian bawahnya ada port USB-C yang berdampingan dengan kisi-kisi speaker.Beralih ke belakang, ada modul kamera ganda yang diatur vertikal. Masing-masing berkualitas 12 megapiksel dan 5 megapiksel, dilengkapi dual LED flash untuk memotret di kondisi cahaya minim. Untuk melihat penjajalan KompasTekno selengkapnya, tonton video hands-on Pocophone F1 via tautan ini.

            googletag.cmd.push(function() { googletag.display('div-gpt-ad-974648810682144181-4112'); });","27/08/2018, 20:48 WIB"
Video Handson Samsung Galaxy Note 9 Langsung dari New York,"NEW YORK, KOMPAS.com -  Samsung Galaxy Note 9 resmi diluncurkan pada Kamis (9/8/2018), di New York, Amerika Serikat. KompasTekno berkesempatan menjajalnya (hands-on) langsung pasca acara perilisan bertajuk ""Galaxy Unpacked"".Pertama kali menggenggam, rasanya sama dengan memegang Galaxy Note 8. Padahal, ada sedikit perbedaan ukuran, di mana Galaxy Note 9 lebih lebar dengan bentang layar 6,4 inci. Ketebalannya pun 0,2 mm lebih tebal ketimbang Galaxy Note 8. Hal ini dikarenakan Galaxy Note 9 membenamkan kapasitas baterai yang lebih besar (4.000 mAh). Samsung mengklaim baterai itu mampu bertahan sepanjang hari dengan pemakaian standar. Pengisian dayanya pun mendukung fast-charging sehingga lebih efisien waktu. Baca juga: Harga Samsung Galaxy Note 9 di IndonesiaBahasa desain Galaxy Note 9 secara keseluruhan tak berbeda jauh dari pendahulunya, Note 8. Perbedaan paling signifikan tampak pada peletakan fingerprint scanner yang tadinya berdampingan dengan kamera ganda, kini dipindahkan ke bawah kamera ganda. S Pen menjadi daya tarik utama Galaxy Note 9, sebab peningkatannya paling signifikan. Pena digital itu bukan cuma bisa mencatat dan doodling serasa di kertas, tetapi juga bisa berlaku seperti remote. (Baca juga: Fungsi Baru S Pen Galaxy Note 9, Tombol Selfie dan Pengontrol Presentasi)Baca juga: Samsung Gratiskan Smart TV untuk Pemesan Awal Galaxy Note 9Penasaran seperti apa pengalaman KompasTekno pertama kali hands-on Galaxy Note 9 langsung dari New York? Tonton hands-on di video berikut ini dan pembahasan fitur-fitur andalan Galaxy Note 9 di video ini.Baca juga: Hasil Jepretan Kamera Galaxy Note 9, Dengan dan Tanpa AI


            googletag.cmd.push(function() { googletag.display('div-gpt-ad-974648810682144181-4112'); });","11/08/2018, 18:02 WIB"
Video Review Singkat Ponsel 3 Kamera Huawei P20 Pro,"KOMPAS.com - Dengan tiga kamera utama yang dirancang lewat kerjasama dengan Leica,  Huawei P20 Pro adalah salah satu smartphone dengan kamera paling mumpuni saat ini.Ketiga kamera yang bertengger di punggungnya tersebut masing-masing terdiri dari unit 40 megapiksel (normal 10 megapiksel) dengan lensa wide angle 27 mm (ekuivalen full frame) f/1.8, unit 8 megapiksel dengan OIS dan lensa telephoto 80 mm f/2.4, serta unit monokrom 20 megapiksel dengan lensa 27 mm f/1.6.Huawei menyematkan teknologi kecerdasan buatan (AI, Artificial Intelligence) bernama Master AI untuk mendeteksi jenis subyek foto dan melakukan penyesuaian parameter pemortetan untuk mengoptimalkan hasil jepretan secara otomatis.Baca juga: Melihat Lebih Dekat Ponsel 3 Kamera Belakang Huawei P20 ProBerbagai mode pemotretan turut disertakan, seperti Night Mode berupa exposure beberapa detik untuk menghasilkan tangkapan gambar yang jernih saat malam hari, dengan stabilisasi gambar oleh AI. Lalu, ada mode hitam putih yang memanfaatkan kamera monokrom pada P20, HDR, simulasi aperture (bokeh), hingga pencayahaan buatan.Di sektor video, Master AI dimanfaatkan untuk meredam goyangan pada footage. Ada juga perekaman slow motion hingga 960 FPS atau 32x lebih lambat dibanding kecepatan normal, di resolusi 720p.KompasTekno mencoba berbagai kemampuan yang ditawarkan oleh Huawei P20 Pro. Simak penelusuran singkatnya dalam video di tautan ini. 

            googletag.cmd.push(function() { googletag.display('div-gpt-ad-974648810682144181-4112'); });","29/06/2018, 20:22 WIB"
Nasib Moderator Konten Medsos Terpaksa Nonton Video Porno 8 Jam,"KOMPAS.com - ""Saya telah melihat ratusan kepala dipenggal,"" ujar seorang perempuan yang diwawancara dalam sebuah video. Wajahnya tak tampak jelas karena membelakangi kamera. Buat kebanyakan orang, pemandangan sadis macam itu pasti membikin bergidik ngeri. Tapi sang perempuan tidak bisa menghindar, karena dia bekerja sebagai moderator konten di  media sosial. Bersama para koleganya yang banyak bekerja lewat perusahaan alih daya (outsourcing), dialah yang berada di garda depan untuk menyaring konten tak pantas di media sosial, menyelamatkan hati para pengguna dengan mengorbankan hati mereka sendiri. Sisi muram kehidupan para moderator konten tersebut diangkat dalam film dokumenter The Cleaner arahan sutradara Moritz Riesewieck and Hans Block. Cuplikannya pekan ini dimuat di situs BBC, sebagaimana dirangkum oleh KompasTekno, Jumat (19/10/2018). 
Para moderator konten media sosial ini menghabiskan 8 hingga 10 jam setiap hari untuk menyaksikan aneka macam konten sadis dan tak pantas, mulai dari ujaran kebencian, adegan bunuh diri, hingga video penyiksaan anak atau binatang, untuk kemudian menghapusnya. 
Mengguncang mental
Perusahaan teknologi memang memasang mesin kecerdasan buatan (AI) untuk menyaring konten. Tapi tangan manusia tetap dibutuhkan untuk membuat lini masa bersih dari kotoran konten.
Mereka adalah sekolompok orang yang direkrut khusus untuk menyaring konten. Para bos-bos media sosial di Amerika Serikat menyebutnya sebagai tim moderator konten.Baca juga: Mesin Pengais Konten Negatif Difungsikan, Tim Trust Positif Kominfo Dilebur
Tugasnya, menonton jutaan posting yang dikirim pengguna sosial seperti  Facebook,  Twitter, Instagram atau  YouTube. Mereka tak hanya memantau unggahan ""normal"" saja, namun juga kiriman mengerikan yang mengguncang mental tadi.
""Ini (moderator konten) merupakan industri tersembunyi di Filipina, di mana banyak perusahaan outsourcing yang berkecimpung di situs media sosial populer,"" jelas Riesewieck, sutradara The Cleaner, yang berarti ""Sang Pembersih"" dalam bahasa Indonesia.
Para moderator berjibaku dengan segala macam konten negatif demi ""membersihkan"" linimasa Mereka hanya bersenjatakan mouse untuk memilih opsi ""hapus"" atau ""abaikan"".Sebagai panduan, moderator diberikan buku aturan main setebal ratusan halaman. Tapi ada kalanya juga mereka masih kebobolan meloloskan konten. Baca juga: Disebut sebagai Penyebar Konten Negatif, Ini Kata TwitterMaklum, mereka kebanyakan hanya diberikan waktu pelatihan sepekan atau paling banyak tiga pekan saja untuk mempelajari semua aturan, sebelum bisa memutuskan konten mana yang harus dihapus dan mana yang harus diabaikan. 
""Misalnya, siapa yang memutuskan apa definisi dari teroris. Mereka punya daftar, mereka harus mempelajari daftar yang mengacu dari departemen keamanan dalam negeri AS,"" terang Riesewieck.
Di sinilah masalah dimulai. Bagi para pekerja muda Filipina yang rata-rata berumur 21 tahun, mereka harus paham betul pedoman yang berkiblat pada undang-undang AS.
""Jika mereka ingat dengan baik, mereka akan memblokir simbol apapun terkait terorisme. Tapi jika mereka hanya melihatnya sekilas, mereka bisa saja salah menerka orang biasa yang ingin protes ke pemerintah, tapi dianggap sebagai teroris"", imbuh Riesewieck.
Tertekan, tak bisa mundurJika terjadi kesalahan seperti kurang memperhatikan konten yang dinilai, para moderator akan mendapatkan masalah besar.
""Ketika memulai pelatihan, saya tidak tahu apa itu moderator konten. Saya benar-benar tidak tahu dan itu kali pertama saya mendengarnya (konten moderator)"", ujar salah satu pegawai wanita.
Ia pun merasa tertekan, menyaksikan serangkaian konten negatif, mulai dari siaran bunuh diri secara langsung, pelecehan seksual kepada anak-anak, perundungan, hingga penjagalan di wilayah perang.
""Saya harus melihat video-video kekerasan anak-anak yang dilecehkan, tindakan dalam video tersebut tak bisa saya maafkan"", aku pegawai wanita tadi dengan suara tercekat.
Sayangnya, ketika ia mencoba mengundurkan diri, kepala tim tempatnya bekerja tidak mengizinkan.
""Dia (kepala tim) bilang bahwa saya harus melakukannya karena itu adalah pekerjaan saya dan saya telah menandatangani kontrak,"" ujarnya.
Nonton pornografi 8 jamDi dalam film The Cleaner, secara kasat mata, para pekerja outsourcing ini digambarkan tak jauh berbeda dengan pekerja kantoran atau pegawai startup. Namun dari cara kerjanya, mereka ibarat pemulung yang menjumput sampah digital.
Misalnya saja seperti yang dialami salah satu moderator yang pernah bertugas untuk Facebook. Ia menuturkan pernah menonton video kucing yang dipanggang di dalam microwave. Video semacam itu tentu berdampak pada psikologis para pegawai.
""Tentu saja hal itu bisa meningglakan trauma yang bisa berujung ke post-traumatic stress disorder (PTSD)"", papar Riesewieck.
Sindrom dimaksud kerap dialami para veteran perang setelah kembali ke lingkungan yang normal. Kondisi itu diamini oleh salah satu psikolog asal Manila, Denise (nama samaran), yang sempat memeriksa kejiwaan dua orang moderator.
""Ada jejak memori di ingatan mereka"", paparnya, dilaporkan Wired.
Beberapa pekerja berhenti dari profesi moderator konten karena terguncang mentalnya. Mereka yang memiliki pasangan mengaku mengalami penurunan hubungan intim dengan pasangannya. Ada juga yang sebaliknya, malah ditimpa kenaikan birahi. ""Apa yang akan Anda rasakan kalau harus terpaksa menonton pornografi hingga 8 jam setiap hari. Berapa lama Anda bisa terima itu?"" tanya sang psikolog. 
Baca juga: Direvisi, Aturan Konten Negatif di Internet Bakal Diperinci
Pekerja lain dengan nama samaran Maria juga mengaku jengah dan terganggu dengan menonton adegan kekerasan seksual kepada anak-anak. Paranoia itu terjadi pula ke pegawai lain dan mempengaruhi kehidupan sosial mereka di dunia nyata.
Di dunia maya, mereka melihat banyak sekali keberagaman, hasil dari konsep demokrasi yang dijunjung tinggi jejaring sosial. Tak jarang, mereka kehilangan akal, menganggap orang-orang di sekitar mereka punya itikad buruk.
Maria mengisahkan, teman-temannya bahkan tidak berani meninggalkan anak mereka dengan pengasuhnya.Kurang perhatian?
Trauma psikologis yang tidak terhindarkan nyatanya kurang mendapat perhatian dari para petinggi media sosial.
""Hampir tidak ada dukungan psikologis yang mumpuni. Mereka benar-benar bekerja, seolah mereka melakukan hal kotor untuk kita semua"", jelas Riesewieck.
Untuk ukuran pekerja muda, para moderator sebenarnya dibayar cukup tinggi jika bekerja di bawah perusahaan media sosial yang matang. Namun menurut Riesewieck, upah tersebut kurang cukup untuk mengatasi masalah psikologis mereka.
""Facebook, YouTube dan Twitter mengatakan bahwa dukungan psikologis tersedia bagi semua pengulas konten, baik yang direkrut secara langsung maupun yang melalui outsourcing"", imbuhnya.
Baru-baru ini, mantan moderator konten yang pernah bekerja untuk Facebook menuntut jejaring sosial raksasa itu. Ia menyebut perusahaan pimpinan Mark Zuckerberg tersebut gagal menciptakan lingkungan kerja yang aman bagi pegawainya, terutama soal kesehatan mental pegawai.
Baca juga: Mantan Moderator Konten Tuntut Facebook, Pekerjaan Bikin Trauma
Facebook pun berdalih dan mengatakan bahwa perusahannya menawarkan akses tanpa batas ke fasilitas kesehatan mental dan berkonsultasi dengan ahli terkait.
""Kami sadar pekerjaan sebagai moderator konten akan sulit. Karenanya, kami menyediakan dukungan yang serius ke para pegawai, mulai dari pelatihan, berbagai manfaat khusus, hingga akses ke fasilitas psikologis,"" kata perwakilan Facebook.

            googletag.cmd.push(function() { googletag.display('div-gpt-ad-974648810682144181-4112'); });","19/10/2018, 19:39 WIB"
